aweme_id,cid,create_time,text,reply_comment_total
7156301698414284037,7180675477949481754,2022-12-24,love that speech but all that throwing soup onto van gogh's painting was completely unnecessary 😭 she couldve chosen a different way 😭😭,3
7147314461160819995,7410365678949630736,2024-09-03,masakit isipin na kaya tayong iligtas n sierra madre pro cya d natin kayang alagaan..masakit na katotohan...maisip lng ntn ang halaga nya pag may bagyo oh kalamidad🥲🥲🥲🥲,3
7148609970748198190,7149709549023937323,2022-10-02,My father believed Harold Camping. It was a trying period.,2
7152250702553779462,7152610210598208261,2022-10-09,bro there was fuckikg 4 in my room tdy,2
7152250702553779462,7152741307990508294,2022-10-10,i leave my window open and they fly in every time,2
7156922485236157701,7157036545357513477,2022-10-21,A Cagliari c’è da più di 6 anni non mi sembra una grande scoperta😅,2
7152250702553779462,7152714744549589766,2022-10-10,yeah living in vancouver rn is not fun,2
7148609970748198190,7150373366158803754,2022-10-03,"Wait, wait… What’s this about the Feast of Anunciatuon??",2
7156922485236157701,7156947964850094853,2022-10-21,però il 53 è comunque in ritardo,2
7158627404683054382,7158659745557037870,2022-10-26,"This is the smartest, brightest. Most Real Woman In Government! Watch her Star Shine over the next 30 years. I will bet on this",2
7143623069284748550,7144442227663405870,2022-09-17,I wish but it’s too late,2
7151334610167794950,7159199689937175301,2022-10-27,"io ho l'ansia quando peno alle persone che hanno l'ansia per il cambiamento climatico, cosa posso fare?",2
7152250702553779462,7152606968422433541,2022-10-09,I thought they were out to get me,2
7148609970748198190,7148780447651136302,2022-09-29,Harold camping… that’s a classic throwback,2
7157857554817748230,7163609151104860930,2022-11-08,جميل جدا,2
7148609970748198190,7154024356804231978,2022-10-13,no man may know the day or the hour,2
7151033928864795909,7151143518463197957,2022-10-05,They care not for the next generations. For the years to come. They only care that the number in their bank account rises.,2
7148609970748198190,7148846836357579563,2022-09-29,I heard a comet is going to dry up the Euphrates river!,2
7144904794828737838,7145044025099027206,2022-09-19,"you need to take into account the humidity for Irish winter.
it's a wet cold not a dry cold.
so it feels colder than it is.",2
7156301698414284037,7188156894296916742,2023-01-13,I kinda get it tho,2
7148609970748198190,7152793662375609131,2022-10-10,It only sounds crazy when you say it all together like that.,2
7150168141916540166,7164435568323150597,2022-11-10,renewable energy is great but you still need oil in order to produce most things we have in this world,2
7153721007835008298,7155801344208864026,2022-10-18,I see no graphite,2
7144573582440484122,7195971892757562139,2023-02-03,จิตใจเยี่ยมมาก ครับ,2
7152250702553779462,7152639238118507270,2022-10-09,THEY ARE ACTUALLY EVERYWHERE 😭😭,2
7158627404683054382,7158634860060705582,2022-10-26,We love you Katie! Keep speaking the truths LOUDLY 🥰,2
7152671402192276742,7152991377545462533,2022-10-10,"Well done, thanks for bringing attention to the challenges salmon are facing because of climate change.",2
7153721007835008298,7153760409343558446,2022-10-12,Water is so cool,2
7144573582440484122,7194820217921815323,2023-01-31,นับถือ ความเป็นตัวตนของพี่ จริงๆ ครับ,2
7153242827323919659,7167523290017104666,2022-11-19,I AM NOT LYING BUT ONE OF MY TEACHER SHOWED THE END AND TALK ABT BETRAYING PPL,2
7153242827323919659,7155692924017066753,2022-10-18,Pls if this was me in class I would be fangirling,2
7143623069284748550,7143792951592911662,2022-09-16,"there is 13,000 tigers left in the world",2
7153242827323919659,7155932398684635950,2022-10-18,bruh ask your teacher if play uh baldi basic but in math class good luck with you,2
7144573582440484122,7196213426532090651,2023-02-04,ทัศนคติ ดีมากครับ ปล่อยว่างไม่ทุกข์,2
7149420236008115457,7149421954658796289,2022-10-01,NAS daily rn 👁👄👁,2
7144573582440484122,7186435040752976667,2023-01-08,สูดยอดเลยค่ะ,2
7152250702553779462,7152911271493796609,2022-10-10,I FOUND ONE ON MY NIGHT STAND YESTERDAY INFRONT OF MY CLOCK AND I ALMOST TOUCHED IT 😭😭,2
7144573582440484122,7144599781905793819,2022-09-18,ใช่เลยคะต้องชะนะใจตัวเองให้ได้จ้า,2
7144573582440484122,7144585994904339227,2022-09-18,สวัสดีคะ คิดดี คิดบวก จริงๆปัญหาแบบนี้มีทุกที่ ที่ไปเจอคนที่เห็นแกตัว เราทำเป็นเฉยๆเดียวเค้าก็แพ้ภัยไปเอง,2
7144573582440484122,7196191625880683265,2023-02-04,เข้าใจค่ะ🥰🥰🥰ที่บ้านเจอแบบี้เหมือนกันค่ะ🥺🥺🥺,2
7157913634226654466,7157940787656688430,2022-10-24,At this point just check ppl’s bags before entering museums,2
7144573582440484122,7186571131758740250,2023-01-09,สุดยอดมากๆครับ,2
7153242827323919659,7153475394003829546,2022-10-12,NO CUZ MY TEACHER USED TO WATCH IT 😃😃,2
7144573582440484122,7176100565432533787,2022-12-12,ปกตินาต้องมีคันนาไม่ใช่ปลูกข้าวติดกำแพงเลย,2
7157913634226654466,7157916441889473286,2022-10-24,"the original girl that went viral did an interview saying that she knows its weird, but the point was to start a conversation an get peoples attention",2
7152250702553779462,7152763999305990918,2022-10-10,One of these flew straight into my eye,2
7144573582440484122,7340277579028742914,2024-02-27,เหมือนเค้าแกล้งเราหรือเปล่าค่ะ,2
7152250702553779462,7152904114321179397,2022-10-10,Oh shit wtf,2
7153721007835008298,7166458655360631558,2022-11-16,Just me that find this terrifying? Once filmed a ppe vid for a nuclear plant that was decommissioning. Nobody told us there was an alarm drill on 1/2,2
7144573582440484122,7187040503324508954,2023-01-10,ขอบคุณความคิดครับปล่อยวาง🥰🥰🥰,2
7153721007835008298,7165046760078967557,2022-11-12,et la plouf il le lâche... Il va retourner sur la Lune avant la fusée SLS mdr 🤣,2
7143962475757604101,7144036803510993669,2022-09-16,"molte volte basta pulire i letti dei fiumi e sistemare gli argini, ma il problema per gli ecologisti sono le frecce tricolori a monza",2
7159681803257662762,7159914883239822126,2022-10-29,"Katie, you are a national treasure. Thank you for all that you do.",2
7148436887957540102,7148450122518692651,2022-09-28,The Shakira outro is tops,2
7143962475757604101,7144279019143480070,2022-09-17,"Raga sono d’accordo con il cambiamento climatico, ma le alluvioni in quelle zone sono sempre successe. Il",2
7155879504114715910,7155881471969526533,2022-10-18,Am still in shock why they still don't understand our continent🥺,2
7159681803257662762,7159684793542001454,2022-10-28,Thank you Katie,2
7155879504114715910,7188967256582980358,2023-01-15,Ur so pretty omgggg 💕💕,2
7155879504114715910,7174229282003534635,2022-12-07,ive lived in nyc all my life its literally my dream to live somewhere where i can like actually see nature 😭,2
7147939302440291627,7151438106960724741,2022-10-06,Why …. We are litterely too young…..,2
7154097477094870318,7154299267200156418,2022-10-14,bro i didn’t know you could stain the air with lights,2
7143962475757604101,7144059048459420421,2022-09-16,il pianeta terra ormai è finito 🥺,2
7147939302440291627,7148017058411545345,2022-09-27,oh so if we dont die immediately then i wanna change it,2
7159681803257662762,7166046178193441578,2022-11-15,It’s too late.,2
7147939302440291627,7148134941413917482,2022-09-27,how long is the clock???,2
7147314461160819995,7147563852518359835,2022-09-26,"sierra Madre says
naalala nyo lang Ako kapag merong bagyo",2
7147939302440291627,7148101586450760453,2022-09-27,How is there a water shortage if all the ice glaciers melt,2
7143623069284748550,7144663455395152646,2022-09-18,Der Eisbär hat mir das Herz gebrochen..,2
7146900341810810139,7259681178424001281,2023-07-25,ทานมื้เดียวเหมือนกันแต่ทำไมน้ำหนักไม่ลงคะ,2
7146900341810810139,7259966318676853510,2023-07-26,หายไปนานมากเพิ่งเห็นวันนี้ 26/6/66,2
7146900341810810139,7249165780859486982,2023-06-27,ผมเคยหนัก 53 ทำงาน5ปี หนัก65เพราะชอบกินเนื้อ3ชั้น ทุกวันนี้ปรับการกิน จากกิน3มื้อ ลดเหลือวันละมื้อพอ จะไปหนักเลยบ่าย3หรือ4โมงเย็น ตอนนี้น้ำหนัก55 🥰,2
7146396688104590634,7147538252110775041,2022-09-26,THE MARKET WHAT??? I CANT UNDERSTAND YOU,2
7155163691657350405,7165443119424324379,2022-11-13,What wrong with the painting.,2
7148436887957540102,7148542910999413510,2022-09-28,crying in the bathroom sold separately 😅😅😅,2
7147746563689893126,7152266738968724267,2022-10-08,well lets take better care of earth its not hard,2
7155163691657350405,7155385721003983622,2022-10-17,but your hair git it🤣🤣🤣🤣,2
7154097477094870318,7159710233727992581,2022-10-28,"Quando eu morava em Sergipe, e faltava luz no meu povoado, o céu era banhado de estrelas! Mas desde que eu me mudei para Santos só vejo a Lua e umas e",2
7156301698414284037,7246109232989979438,2023-06-18,Icon,2
7155163691657350405,7155400777950053125,2022-10-17,how much palm oil do heinze use,2
7147746563689893126,7148647482515243818,2022-09-29,that's your governments for you,2
7148436887957540102,7148512010563502853,2022-09-28,"don't worry about big corporations polluting, they give a bunch of money and now they're ✨ carbon neutral ✨",2
7146900341810810139,7311270725925765894,2023-12-11,"ดีจังเลยค่ะ
กินวันมื้อเช่นเดียวกันค่ะ 🥰🥰🥰",2
7156301698414284037,7224740633297388334,2023-04-22,"yes let's discuss. yes we should be looking at alternative means. however, (per her point) what about the environmental impact of Wind Turb.? yes...",2
7154373264914009350,7183445115691975430,2022-12-31,and their response is... vandalism?,2
7152250702553779462,7152928534897378053,2022-10-10,why...why would we be moving them from one place to another? 😭,1
7152250702553779462,7152771538412290822,2022-10-10,everyones focusing on the stink bugs when im still stuck on the massive spider at the beginning 🧍‍♀️,1
7152250702553779462,7152807721522660102,2022-10-10,they everyfknwhere,1
7152250702553779462,7152938471182484230,2022-10-10,maybe i'm in a lucky spot bc i don't see any???,1
7152250702553779462,7152760681425666821,2022-10-10,Omg,1
7152250702553779462,7152749790669177605,2022-10-10,there was a HUGE one in my workplace yesterday and I screamed. truly hoping not to see more,1
7152250702553779462,7152873318214714117,2022-10-10,Why is no one talking about the spider 😳,1
7156549294097435909,7156866244393288454,2022-10-21,Io non so che problemi hanno i miei occhi ma mentre il mio ragazzo la vedeva verde io l’ho vista bianca 😳,1
7153721007835008298,7156155122217075461,2022-10-19,forbidden swimming pool,1
7143962475757604101,7144047998954832645,2022-09-16,e colpa delle deforestazioni perché gli alberi intrappolano anidrite carbonica in mancanza di essi e il mare a raccogliere anidride carbonica (continu,1
7155163691657350405,7164897570953921285,2022-11-11,skay ig,1
7155879504114715910,7155943016594440961,2022-10-18,love you 😍 💗,1
7157857554817748230,7163298020409852678,2022-11-07,🙀,1
7157857554817748230,7160813637232722694,2022-10-31,عاش والله🥰❤️,1
7155879504114715910,7156025097220539182,2022-10-19,Powerful words and beautifully spoken 🌺💯♥️,1
7157857554817748230,7163675214357431045,2022-11-08,جميل جدن,1
7156922485236157701,7157004470051930885,2022-10-21,POV: I Bro non conoscono i filobus/Iveco Urbanway,1
7155879504114715910,7155880658251563822,2022-10-18,I'm glad you broke character to make this PSA about people around us who sustain and support us.,1
7156922485236157701,7157061645247447814,2022-10-21,Venesia se avanti,1
7143962475757604101,7143965444053975813,2022-09-16,"io vivo nelle Marche vicino al conero, casa mia si è allargata, i sottopassaggi erano pieni d'acqua e la tempesta è durata 6 ore",1
7144573582440484122,7186261908248429338,2023-01-08,ขอบคุณมากนะคะ ถึงแม้ว่าจะต่างกรรมต่างวาระ แต่เรื่องราวของคุณทำให้เราปล่อยวางบางอย่างได้ทันทีเลยค่ะ ขอบคุณอีกครั้งนะคะ 🥰❤️,1
7155879504114715910,7173419334156862209,2022-12-04,I bought three lions yesterday how fancy is that,1
7155163691657350405,7164478318212301573,2022-11-10,as I agree with what she is saying but what I don't agree is the roadblocks and stoping ambulances with people in them that could be dying,1
7156922485236157701,7156948786517197573,2022-10-21,si c'è anche da dire che il lido è piccolo,1
7155879504114715910,7155800776475542278,2022-10-18,i agree wth you,1
7155539942368759083,7155756536807506731,2022-10-18,Need that for my Subaru somehow,1
7155879504114715910,7161238149078008618,2022-11-02,I LOVE UR ACCENT,1
7155163691657350405,7155385390714389253,2022-10-17,cud hv put that tin of soup 🍲 in a food bank 😂,1
7143962475757604101,7144207164373762821,2022-09-17,crisi climatica? ....,1
7154373264914009350,7154404694935765766,2022-10-14,3 months for her please,1
7154373264914009350,7154411727252521733,2022-10-14,That's it I'm walking home tonight,1
7143962475757604101,7144575417260540677,2022-09-18,che Dio ci aiuti 😪🙏,1
7144573582440484122,7144632679375176475,2022-09-18,จริงคะ,1
7143962475757604101,7144068171393614597,2022-09-16,Io sono nelle Marche ma dove abito io non è arrivato,1
7154373264914009350,7182961999570125573,2022-12-30,You’ll have to have a license to buy paint soon,1
7154373264914009350,7159265204001129222,2022-10-27,"Fundamentally I don't want to give up oil, I drive a hgv and it can't run without diesel which is made from oil. how do we get food in the shops ?",1
7153721007835008298,7184239501157155589,2023-01-03,No se pudre el agua?,1
7156301698414284037,7220973353250259755,2023-04-12,Slightly….🤨 riiight,1
7156301698414284037,7222421945328993066,2023-04-15,your actions are futile no matter what happens corporations with money will always change laws to benefit them selves,1
7153721007835008298,7155947753456861957,2022-10-18,that water looks heavy 😂😬,1
7156301698414284037,7220006643200066350,2023-04-09,we whould even think of doing it if it wasn’t behind glass🤓,1
7153721007835008298,7162978519010034437,2022-11-06,"If they find an efficient way to dispose of radioactive waste, nuclear power will replace every energy source",1
7153721007835008298,7164361211097006874,2022-11-10,what will happen if you jump in that pool,1
7153721007835008298,7163691980462818054,2022-11-08,nuclear power. the answer staring us in the face for 50+ years. why do people dislike it again?,1
7157857554817748230,7163323248653894402,2022-11-07,🥰🥰🥰🥰🥰🥰🥰,1
7156301698414284037,7285956642886714158,2023-10-04,"It can still damage the painting due to moister and it going under the glass, also it could be damaged by the cleaning afterwards but they are getting",1
7153721007835008298,7154662484720288514,2022-10-15,is there a way to use the spent rods for power of some sort?,1
7143962475757604101,7144050585813435142,2022-09-16,"Quelli che fanno finta di non vedere è anche la carenza i tagli che sono stati fatti per la pulizia dei canali, forestali, edilizia .E poi i morti!!😡",1
7144573582440484122,7186029597367960346,2023-01-07,ขอบคุณมากเลยค่ะ🥰,1
7155163691657350405,7184890172387214086,2023-01-04,"Why do they all look like they need a good wash, I know they wanna stop oil but don’t stop",1
7154373264914009350,7158084655077720838,2022-10-24,wait until there is no oil based paint left. then what you going to do?,1
7143962475757604101,7144658469291148037,2022-09-18,"tutti parlano di Cingoli Macerata...
ma i peggio sono i paesini di campagna io sono di Treia le strade inondate di terra e acqua per colpa dei fossi",1
7144573582440484122,7196270327613555482,2023-02-04,จิตใจคุณงดงามมาก,1
7143962475757604101,7149177952567313157,2022-09-30,nel terzo video è il paesino in cui vivo e li è cascato pure un ponte,1
7154373264914009350,7186233699004285701,2023-01-08,"While climate change is certainly a problem, piggybacking a mindless movement for a chance to get away with mindless vandalism is the opposite way to.",1
7143962475757604101,7144055300185670405,2022-09-16,"Prima la siccità, poi le alluvioni... ma non si era predetto che avremmo avuto un lungo periodo di siccità?",1
7152671402192276742,7152678532748313387,2022-10-10,"Dang, that was a delightfully informative fire hydrant of good information",1
7154373264914009350,7162197188625351429,2022-11-04,"that will help a lot, i think",1
7154373264914009350,7183029739904811782,2022-12-30,Well you’ve just proven yourself guilty 😂,1
7143962475757604101,7144101744309093125,2022-09-16,per me è più una crisi politica e gestionale perché questi episodi sono sempre accaduti ma prima venivano gestiti nel modo giusto,1
7143962475757604101,7144382054150963973,2022-09-17,Non vedo non sento e non parlo🥷🏻,1
7154373264914009350,7164296994076099334,2022-11-10,Caught red handed 😂,1
7154373264914009350,7185604983085024005,2023-01-06,"I mean, she got a point.",1
7154373264914009350,7183186568293663494,2022-12-31,I'm bare confused on what a sign did to oppose their views😭😭,1
7154373264914009350,7185404540241412869,2023-01-06,isn't that criminal damage,1
7154373264914009350,7184799788385731334,2023-01-04,U do know that spray paint has oil in,1
7143962475757604101,7144239623974421254,2022-09-17,"Questi eventi ci sono sempre stati nella storia della Terra ed anche di più spaventosi e distruttivi, anche quando non c'erano le auto elettriche...",1
7153721007835008298,7153768984783913771,2022-10-12,This is how Baja blast is made,1
7157857554817748230,7160311109194433286,2022-10-30,عاش,1
7155879504114715910,7155882668310758150,2022-10-18,God I love you. Your so sarcastic and funny ❤️,1
7157857554817748230,7164251301055054597,2022-11-10,نَوً,1
7145640089220222254,7145946680634753838,2022-09-21,Not trying to take away from all this wonderful info but like show us your nails 🥰💅,1
7148609970748198190,7163349253407949614,2022-11-07,you missed the Y2K 😂,1
7158627404683054382,7158806505375531822,2022-10-26,We need thousands more like you in government,1
7148609970748198190,7149253238453732139,2022-09-30,"idk man, I saw a dove fart yesterday. Based off of my research the second coming is right around the corner.",1
7158627404683054382,7158685679905145646,2022-10-26,"We need people like Porter in public service. Please vote for her, she is fantastic. 🔵",1
7148609970748198190,7152470578406392622,2022-10-09,He said Hallie Bap,1
7148609970748198190,7148834720193184555,2022-09-29,"you know, they say a comet will destroy the earth this year. ☠️",1
7158627404683054382,7158634037656634158,2022-10-26,SLAY!!!,1
7148609970748198190,7162370052233429802,2022-11-05,"*me, sees my golden birthday*
oh. oh that explains SO MANY THINGS",1
7148609970748198190,7148851363240395566,2022-09-29,how did you miss Y2K?!!,1
7144573582440484122,7144595270684132123,2022-09-18,เหมือนๆกันเลยค่ะไม่อยากมีปัญหา,1
7147746563689893126,7169567014586303233,2022-11-24,I LOVE MICROPLASTIC,1
7158627404683054382,7158644687699378986,2022-10-26,Yes. Also. I love you.,1
7144573582440484122,7144584700375778074,2022-09-18,"อนุโมทนา..สาธุเจ้าค่ะ
ปล่อยวาง..แล้วจะบางเบา
ปล.หนูอยู่ข้างอิแม่..เด้อจ้า😏",1
7149209471833820462,7149537818300302086,2022-10-01,credit to the company who supplied and fitted that camera,1
7158627404683054382,7158632148633895722,2022-10-26,You’re The Best. And millions SEE you. Keep Going !!,1
7147939302440291627,7148311374907966214,2022-09-28,It’s greed they don’t care all they want is money so the bump are airs to make us sick to make us all be dead,1
7157913634226654466,7186534811938849541,2023-01-09,how does throwing mashed potatoes at a painting help with global warming 💀,1
7143344050417077509,7143411207427752709,2022-09-15,oh that toilet is brewing,1
7149420236008115457,7149421438888526594,2022-10-01,Nuuk gets pretty windy 😂,1
7148609970748198190,7149895305508127531,2022-10-02,Whyyyy did you skip over Y2K?,1
7147746563689893126,7152236367313306411,2022-10-08,oh okay,1
7148609970748198190,7148844452970971950,2022-09-29,I love the npc chat loops you had there,1
7148436887957540102,7148519778133902086,2022-09-28,A PLASTIC STRAW????,1
7147939302440291627,7148059889029907206,2022-09-27,put tw.,1
7145493259815603461,7145726168572986118,2022-09-21,"thousands of years of science masterminds figuring out how the world works vs. ""YEAH I DON'T THINK SO"" 🤦🤦🤦🤦🤦🤦",1
7145493259815603461,7152010885200560942,2022-10-08,Change climate change to environmental change and see how much supporters you’ll get.,1
7145640089220222254,7145892263544701738,2022-09-21,** I am not here to stir up conspiracy im just highlighting that these coincidences are alarming and we need to pay attention to our planet!,1
7147746563689893126,7150076984458380074,2022-10-03,😂 Y’all didn’t know how it works? Y’all thought that pollution meant “dirty” for the past 20 years no it’s toxic and eventually it’s gonna get so-,1
7147746563689893126,7158252073687499562,2022-10-25,Not my fault,1
7147746563689893126,7152237075433456389,2022-10-08,This is going to be the lead/CFCs of this generation. Except it's so much harder to contain,1
7147746563689893126,7149473761448198918,2022-10-01,Still unknown what the harm of microplastics might be,1
7147746563689893126,7148624366861943558,2022-09-29,if that’s a credit card where does it go,1
7144904794828737838,7145128414625301253,2022-09-19,Who's guessing UK??,1
7147746563689893126,7149453381416780550,2022-10-01,Lead Paint was safer.,1
7158627404683054382,7158644045567656750,2022-10-26,@showme_yourmask did you know Katie Porter has 2 accounts now?,1
7147746563689893126,7155688328717009669,2022-10-18,if they research this why not put us on bio degradable plastic years ago,1
7147746563689893126,7148273637745017606,2022-09-28,well it’s in all of us too,1
7158627404683054382,7158633189728502570,2022-10-26,Yes! Taylor would be proud of this 😁,1
7144904794828737838,7145132476074754822,2022-09-19,This is common knowledge,1
7159681803257662762,7159949223157646126,2022-10-29,PUT ME IN COACH.,1
7144904794828737838,7147287615330419461,2022-09-25,Spain and Portugal are in Europe,1
7157913634226654466,7158792134102516481,2022-10-26,"this is a good tactic to spread their message ngl, the paintings not gonna get damaged it has a layer on top, it spreads news quickly",1
7145640089220222254,7145803061452604206,2022-09-21,Mother Nature is for sure speaking to us with the synchronicities. High key. 🌿 She’s not playing with us.,1
7147939302440291627,7148307398292357894,2022-09-28,"Great, i will not even have kids by then💀",1
7146900341810810139,7267238671073215233,2023-08-14,จริงค่ะ /เรากินมื้อเย็นมื้อเดียว ไม่เจ็บไข้ไม่ป่วยเลยค่ะ 12 ปีแล้วที่กินแบบนี้,1
7146900341810810139,7385903519314739969,2024-06-29,น้ำกรดจะออกมาในแต่ละมื้อแต่ถ้ากินมื้อเดียวน้ำก็จะไม่กัดกระเพาะหรอครับ,1
7157857554817748230,7164963226726990597,2022-11-12,او ممكن نراعى ونتقى ربنا,1
7146900341810810139,7267294266559791890,2023-08-14,กินข้าวมื้อเดียวและกินมังสวิรัติเหมือนกันค่ะ 🙏💝,1
7146900341810810139,7247123032099242758,2023-06-21,ทำไม ลุงพลเหมื่อนพี่จัง,1
7159681803257662762,7159682485717173035,2022-10-28,Hell yes…. You are amazing!!!!!!!,1
7146900341810810139,7266967837636477701,2023-08-14,ทำไม่เป็นโรคกระเพาะนะ,1
7146900341810810139,7429368540602745601,2024-10-24,กินมื้อเดียวเฉพาะตอนเย็นได้ไหมครับ,1
7155879504114715910,7155769880397906693,2022-10-18,"As Travor Noah said you can't feel poor if all people near you are ""poor"" that's us African we are proud 🙌 Love your Content Sister 🇿🇦",1
7146900341810810139,7447455310317749010,2024-12-12,อร่อยๆๆค่ะอาหารโปรดเลยค่ะ,1
