aweme_id,cid,create_time,text,reply_comment_total
7149908239491108101,7249099502224163589,2023-06-26,حياك الله دكتور,0
7149908239491108101,7177480107417862917,2022-12-15,رحمه لهللك وزني فوق ١٠٠ شلون اضعف اريد نصاحك,0
7149908239491108101,7177373254490407686,2022-12-15,اني ولله من اشرب مي معتي متتقبل وتتعصر,0
7149908239491108101,7175188339403211526,2022-12-09,تجلس وتقول بسم الله ثم تشرب على ثلاث دفعات هكذا علمنا الرسول صلى الله عليه وسلم,0
7149908239491108101,7164444326428361477,2022-11-10,تم,0
7149908239491108101,7177480431092122374,2022-12-15,والله اني عندي ارتجاع مرئ,0
7149908239491108101,7177451821269582593,2022-12-15,دكتور عندي امساك دائمآ,0
7149908239491108101,7167867356164653829,2022-11-19,اللهم صل علي محمد وال محمد,0
7149908239491108101,7177131271906165510,2022-12-15,اني عندي ارتجاع المرء شكرا دكتور على المعلومه,0
7150168141916540166,7150349924826678021,2022-10-03,I drive hgv I use 200+ litre a day I am doing my best 🔥,0
7151033928864795909,7151171816911536901,2022-10-05,"Unfortunately, ALL LEADERS, claim zero emissions but all fossil fuel is business as usual EVERYWHERE",0
7152250702553779462,7152574792440480518,2022-10-09,Lol except when they jump on your car and you can’t get rid of them,0
7151033928864795909,7154664469711946497,2022-10-15,"Shes so inspiring. Riveting in her bravery, but also in her ability to be so articulate while being carried away like a sack in a prone position! 😳",0
7152250702553779462,7152608574581392133,2022-10-09,These stinking bugs are everywhere!!!,0
7152250702553779462,7152752693625979653,2022-10-10,Are we not gonna talk about the massive spider just chillin there,0
7152250702553779462,7152599065905021702,2022-10-09,"I woke up to one of these scratching my back because I was sleeping on one, traumatized 💀",0
7144573582440484122,7459266852738745105,2025-01-13,รางวัดเลยค่าาา,0
7152250702553779462,7153470091417928454,2022-10-12,Please see our pinned video on how to prevent and control these bugs.,0
7152250702553779462,7152584006680560390,2022-10-09,there's been tons inside my house 😳,0
7152250702553779462,7152744835345072901,2022-10-10,Omg are you f kidding me! I will move them to a box and send to Parliament!!,0
7152250702553779462,7152562783284069125,2022-10-09,"The biggest pest alert would've been the politicians themselves , not the insects.",0
7151334610167794950,7159936781076480773,2022-10-29,Io ho l’ansia alla mattina quando mi sveglio alle 5 perché sono povera,0
7151334610167794950,7153250117728912134,2022-10-11,😂😂😂 ma che generazione siamo diventati,0
7144573582440484122,7448266669707559696,2024-12-14,เป็นกำลังใจให้น่ะครับ,0
7151334610167794950,7153750455591551750,2022-10-12,6) fai informazione a favore del nucleare :),0
7151334610167794950,7160345808042443526,2022-10-30,ma cosa sto sentendo ???? per il cambiamento climatico ???,0
7151033928864795909,7400104171766874885,2024-08-06,🤣😂😂🤣😂I thought that was a pic until I watched it twice,0
7151033928864795909,7292011896801248033,2023-10-20,"I'm doing this for my son, what being carried away by police",0
7151033928864795909,7151264610644951809,2022-10-06,Facts,0
7151033928864795909,7400687797701624609,2024-08-08,can you Imagine her son when all his friends c this vid 🤣,0
7159681803257662762,7165715595740906286,2022-11-14,"Love you from Houston, Tx. 26th yr as an elementary teacher, purple expo is correct.",0
